{
  "evaluator_pipeline": "nvidia-frame-two-lobe-layer-stack-budget-adapted-v1",
  "evaluator_checkpoint": "artifacts/runs/unified-scattering-03/smoke-nvidia-original-joint-v2/checkpoints/best.pt",
  "sampler": "nvidia-diffuse-ggx9",
  "steps": 2,
  "batch_size": 2,
  "learning_rate": 0.0003,
  "final_learning_rate_fraction": 0.05,
  "weight_decay": 0.00001,
  "gradient_clip": 5.0,
  "validation_interval": 2,
  "checkpoint_interval": 2,
  "seed": 20260824,
  "device": "cuda",
  "deterministic": true
}
