{
  "evaluator_pipeline": "core-frame-neural-v1",
  "evaluator_checkpoint": "artifacts/runs/unified-scattering-03/formal-core-frame-seed-20260824/checkpoints/best.pt",
  "sampler": "nvidia-diffuse-ggx9",
  "steps": 10000,
  "batch_size": 16,
  "learning_rate": 0.0003,
  "final_learning_rate_fraction": 0.05,
  "weight_decay": 0.00001,
  "gradient_clip": 5.0,
  "validation_interval": 250,
  "checkpoint_interval": 250,
  "seed": 20260824,
  "device": "cuda",
  "deterministic": true
}
